"Article ID";"Published date";"Headline";"Url";"Outlet Name";"Author Name";"Country";"Language";"Impressions";"Shares";"Coded"
"03bdda2993ac684ea8f2dd67c5dcd6d2c8f5423f6c18b05c51ed3988983af39f6fc7912b48f6aa61cea6d9d8b42a77c17980b51ec5618a8d54ba06b0ff0628c7";"2023-07-04 05:37:00";"Salesforce se suma a la carrera de la IA generativa con su  propio gran modelo de lenguaje y agrega un nuevo aporte";"https://www.forbesargentina.com/innovacion/salesforce-suma-carrera-ia-generativa-su-propio-gran-modelo-lenguaje-agrega-nuevo-aporte-n36386";"forbesargentina.com";"Sourtech";"Argentina";"es";"14777";"3";"2"
"f1b6e6e8d50cf2b05311b80bb9aa70b33994a97a7b314b3672bbea4356e1f93ab8cc9beb425fb4469ff3d6e74f8cf8e8110570c70c23780b02f2e1a37f9a95cf";"2023-09-12 10:35:03";"Salesforce anuncia su nuevo asistente con inteligencia artificial, Einstein Copilot";"https://www.infobae.com/espana/agencias/2023/09/12/salesforce-anuncia-su-nuevo-asistente-con-inteligencia-artificial-einstein-copilot/";"infobae.com";"unknown journalist";"Argentina";"es";"1529212";"1";"2"
"fe4a9c27de3a6355291f39f747dff565392fa9ab009f6bb060fc297c654166902c4bf1d0a654393c56fe468b73564dbb005b70fae0a5146bc57bb2c1de56cb8d";"2023-09-01 10:40:00";"Rimini Street anuncia Rimini Support™ para SAP Industry Solutions (soluciones sectoriales de SAP), maximizando el valor y ampliando la vida útil de los sistemas críticos";"https://www.lanacion.com.ar/agencias/rimini-street-anuncia-rimini-support-para-sap-industry-solutions-soluciones-sectoriales-de-sap-nid01092023/";"lanacion.com.ar";"unknown journalist";"Argentina";"es";"1095407";"0";"2"
"d6a16c030ea59c586db0a761cd862ed0ec59f80f05cf0c6f7f3d08138be9b2f923a145490d123f86f9c18455ce719190f84a5b9399b7fd4e566b9334d4febc19";"2023-09-18 09:05:00";"Salesforce y Google amplían colaboración para impulsar productividad empresarial con IA Generativa";"https://www.itsitio.com/ar/salesforce-y-google-amplian-colaboracion-para-impulsar-productividad-empresarial-con-ia-generativa/";"itsitio.com/ar";"Redacción de ITSitio";"Argentina";"es";"4179";"0";"2"
"2963e060bbf9103ac531c5e668ad8a0657054c91bcd87f80d645fb860f75affd5a2e185d1768f3d09358fb9aa3e8776769136d8bd67920eb79a0cfe5d67e921e";"2023-09-06 03:07:00";"Esta reconocida acción está ""infravalorada"" y puede ser una gran oportunidad";"https://www.forbesargentina.com/money/esta-reconocida-accion-esta-infravalorada-puede-ser-una-gran-oportunidad-n40244";"forbesargentina.com";"unknown journalist";"Argentina";"es";"18077";"0";"2"
"73a8efd8babd6f3a91e7fcede32bb31fc0558e3f4e4bebcde9f8bb95c1ec49dc9e4a9ff9416d4b62bfdddd322f9d72c31f01423f22a6ff113bd40f8c0900e9c6";"2023-09-12 06:08:07";"Temas del día de EFE Economía del martes 12 de septiembre de 2023";"https://www.infobae.com/espana/agencias/2023/09/12/temas-del-dia-de-efe-economia-del-martes-12-de-septiembre-de-2023/";"infobae.com";"unknown journalist";"Argentina";"es";"1529212";"0";"1"
"73b2b3c289f0a19f167b145e6f2aeedd7aedeaa64e221c54b566ae01836e969e6344b68157de78d856fa925ad5e7036f43dd95bcc19370789951d531cf78d5f8";"2023-07-06 10:21:00";"Empresas desesperadas por revitalizar las oficinas";"https://ct.moreover.com/?a=51239123708&p=8vr&v=1&x=WM4mRtHegSuPGbTst_33fQ";"iprofesional.com";"unknown journalist";"Argentina";"es";"136778";"9";"2"
"60cae10931d79551318552c3d1212c5f8339cc2426457256b4e8c1721caa5f90960fdfb43a4cea47711561b794c4cfd8adaea320bef19108e4426f59dfd02feb";"2023-07-05 14:40:00";"Rimini Support™ permite que Gachon University Gil Medical Center avance en sus proyectos de transformación digital y continúe brindando servicios a la comunidad como hospital pionero";"https://www.lanacion.com.ar/agencias/rimini-support-permite-que-gachon-university-gil-medical-center-avance-en-sus-proyectos-de-nid05072023/";"lanacion.com.ar";"unknown journalist";"Argentina";"es";"998020";"0";"2"
"ccb4b99ff14f4b5fcc157b548b4f60adec3ece648eea1e5f5636cf1d986ff473c51637c9915e884e6fddf4d46f0f36c37e1afd91f4c5941a130acb3f8a6fd7be";"2023-08-07 11:32:36";"La inteligencia artificial irrumpió en las empresas: cómo pueden los empleados aplicarla de forma segura";"https://www.iproup.com/innovacion/41902-inteligencia-artificial-como-aplicarla-de-forma-segura-en-firmas";"iproup.com";"unknown journalist";"Argentina";"es";"7552";"1";"2"
"0610e805f9c71eed7cf068bcc15d2def1b5506442771762acb01ee2da907771c5d6bc9dce270c7837b2638e0e0f416c3767524dc48014865690e8fdf72aebff9";"2023-07-03 09:35:00";"Estas son las mejores acciones de la primera mitad de 2023: Nvidia lidera el renacimiento de las grandes tecnológicas";"https://www.forbesargentina.com/money/estas-son-mejores-acciones-primera-mitad-2023-nvidia-lidera-renacimiento-grandes-tecnologicas-n36333";"forbesargentina.com";"Sourtech";"Argentina";"es";"14777";"2";"2"
"9d9fbe6386ac1ae9bc8989f6291149d083918e190a17125261b97eb787f496733beaa8d3e28ce4157df8d192ed5ab0bc6dd8b7f817d0c2b343ce6808395746d8";"2023-08-31 05:41:00";"Salesforce multiplica por 18 los beneficios de su segundo trimestre fiscal y gana 1.165 millones de euros";"https://www.lanacion.com.ar/agencias/salesforce-multiplica-por-18-los-beneficios-de-su-segundo-trimestre-fiscal-y-gana-1165-millones-de-nid31082023/";"lanacion.com.ar";"unknown journalist";"Argentina";"es";"1095407";"0";"2"
"e9e8be06f5230e1c337bc0fc168b755a122d3b0b0c35c778d30f3ceb1299f0732b45305d089c96fe7a51933ad4a3f7cd63e1813e122cf4fc0ac96054f06e01c3";"2023-09-19 12:20:00";"Salesforce lanza nueva generación de Einstein con IA conversacional";"https://www.itsitio.com/ar/salesforce-lanza-nueva-generacion-de-einstein-con-ia-conversacional/";"itsitio.com/ar";"unknown journalist";"Argentina";"es";"4179";"0";"2"
"f6e46a82a484e572f458b4d57da4d715c62db611b032ddc9ad3491a18061b4347719c8583230beeffd8fc89936de09e8e3c7db458dfb1ab405a5d3cd995c2d1a";"2023-09-29 09:39:40";"Google y Salesforce se unen para impulsar la productividad en el trabajo: ¿cómo lo harán?";"https://www.iproup.com/innovacion/43172-google-y-salesforce-se-unen-para-impulsar-la-productividad";"iproup.com";"unknown journalist";"Argentina";"es";"7552";"21";"2"
"b463ad6b8ba754534d9c3a2cd3fb9f650a56b5672f0976c314ad9c467c451f6f8a22232e72dfe67640aeb5cd810aac4a47fb78ce0eaa3096ca18980d90d3a736";"2023-08-02 05:43:00";"Microsoft apuesta por la IA generativa y anuncia nuevos precios y funciones para Copilot";"https://www.forbesargentina.com/innovacion/microsoft-apuesta-ia-generativa-anuncia-nuevos-precios-funciones-copilot-n38219";"forbesargentina.com";"Daniel Newman";"Argentina";"es";"18077";"1";"2"
"6b0b5395422f2b38f612f524bf14af4d87568fc7b829bff01134b7661f7b25663b709ae7483b07f2f1a5a87dcb1a6bd399525d5f161e427c4149edf06febc3f4";"2023-08-29 14:20:05";"Existe una creciente desconfianza hacia la IA y las empresas que la utilizan: así lo mostró una encuesta";"https://www.iproup.com/innovacion/42506-encuesta-muestra-una-creciente-desconfianza-hacia-la-ia";"iproup.com";"unknown journalist";"Argentina";"es";"7552";"23";"2"
"256d4c26e81ceedc113d58cd02330698c1836e8dc4fb174ef574d2f1b2f0a36240f2bc77fe93aadcd96879b261519bb33355cf5289a7ad2360b913114ca3cca1";"2023-07-06 15:37:28";"Mientras los negocios anhelan la inteligencia artificial en el trabajo, las compañías tecnológicas se apresuran a proveerla";"https://www.infobae.com/thenewyorktimes/2023/07/06/mientras-los-negocios-anhelan-la-inteligencia-artificial-en-el-trabajo-las-companias-tecnologicas-se-apresuran-a-proveerla/";"infobae.com";"Newsroom Infobae";"Argentina";"es";"1442272";"3";"2"
"05adf24e28fdff8ce9ccde9b8ca47154317caee1987561988dbf0f66dfb7ba7dff0e3c7afebc33fc89238b5bbd227fc516187ed18811bdcb17c26d1b06ca14bc";"2023-07-30 00:39:04";"5 alternativas para invertir en Inteligencia Artificial";"https://www.ambito.com/opiniones/5-alternativas-invertir-inteligencia-artificial-n5781893";"ambito.com";"Javier Padrón";"Argentina";"es";"283832";"4";"2"
