"Article ID";"Published date";"Headline";"Url";"Outlet Name";"Author Name";"Country";"Language";"Impressions";"Shares";"Coded"
"b2b8fb2be32874219ed0085a53d2bd22c8698c3e037898735057afe28622d778694ec9e888f664cfae63a921f4331840b0d929984b0f2bb9cd0378f85395cdfa";"2023-10-19 05:58:00";"IBM e AWS expandem parceria para aprofundar soluções de IA Generativa";"https://inforchannel.com.br/2023/10/19/ibm-e-aws-expandem-parceria-para-aprofundar-solucoes-de-ia-generativa/";"inforchannel.com.br";"Unknow Jornalist";"Brazil";"pt";"8194";"0";"2"
"d0d1011c9f4680543cf994b57e55af282f3171ed8a40d04433ff43054cd5b3291e3684ca4668e1a0f0c9a4396998eab57cdc2bf9bf99c9bd2d0a97d733ba00d3";"2023-10-02 03:16:00";"Amazon Web Services incorpora cinco innovaciones de IA Generativa en su plataforma";"https://www.forbesargentina.com/innovacion/amazon-web-services-incorpora-cinco-innovaciones-ia-generativa-su-plataforma-n41646";"forbesargentina.com";"Pablo Wahnon";"Argentina";"es";"18077";"45";"2"
"01bfa8e948b3ec279adc6c795fc5d039481549585b2816d97daaf57ad6ffffa89f1d5779f4ea73bbe7d6f875cb1f7b35c092642a14f7a54cbada693f0541d145";"2023-10-09 20:00:00";"Salesforce y AWS hacen integraciones para ayudar a los clientes y transformar sus negocios con inteligencia artificial (IA)";"https://geekzilla.tech/salesforce-y-aws-hacen-integraciones-para-ayudar-a-los-clientes-y-transformar-sus-negocios-con-inteligencia-artificial-ia/";"geekzilla.tech";"unknown journalist";"Mexico";"es";"2731";"1";"2"
"cff85445cd02ce96c3c81c9ac49f9ab3a8a5359532166b8c633102b99c980299059e9359f8f68b304e96e6f7848257bd2da05d9962f7ddf8fa4c8274a23a410a";"2023-10-18 00:00:00";"IBM Expands Relationship with AWS to Bring Generative AI Solutions and Dedicated Expertise to Clients";"https://www.theglobeandmail.com/investing/markets/stocks/AMZN/pressreleases/21211132/";"theglobeandmail.com";"Journalist Unknown";"Canada";"en";"534982";"0";"2"
"d18b41e2e39728a325386daf18faa770d76b42960bff1d4a845783f9d0c6253a371183f01ae1318afea0eccb5c5958298a2f2771be3e818cf8d15279e926acfa";"2023-10-23 07:35:00";"Hashtag Trending Oct.23 – Major corporations announce tech layoffs; IT contractors have covertly funnelled millions of U.S dollars to North Korea; IBM and AWS have expanded their partnership";"https://channeldailynews.com/news/hashtag-trending-oct-23-major-corporations-announce-tech-layoffs-it-contractors-have-covertly-funnelled-millions-of-u-s-dollars-to-north-korea-ibm-and-aws-have-expanded-their-partnership/83550";"channeldailynews.com";"Journalist Unknown";"Canada";"en";"1175";"0";"2"
"5dd25958b7ee66c63619aca86e6e6259f959d235ab0f0f2ea6feff028bc7099bdde1f86f2894422b81faa3a0958433e1af2080bb6d9591bf396a8bfcadc1e6c7";"2023-10-23 08:00:00";"Arctic and Amazon connect through Indigenous art | CBC Radio";"https://www.cbc.ca/radio/ideas/arctic-amazon-mural-inuk-shipibo-artists-1.7005092";"cbc.ca";"unknown journalist";"Canada";"en";"1116090";"3";"2"
"5b1f762c42990657af76c4a1d3509748bc8289b603b14cc5fc458e2b147745a40bc4bca15a0ebb0ece3a2475809353ab011374622e155426b60d78d30b4b705c";"2023-08-04 13:25:52";"Cloudhesive adquiere Eplexity, uno de los principales premier partners de Amazon Web Services";"https://www.iproup.com/innovacion/41960-cloudhesive-adquiere-eplexity-de-amanzon";"iproup.com";"unknown journalist";"Argentina";"es";"7552";"1";"1"
"d012295fe45782e5924340a68a16f0f0d49576d797bf175d85f5388a14109400a693120249db0a71a82ec23e2b7862c5e6f8ddb34173e337c4a55e05f96fb2b8";"2023-08-04 15:31:17";"Cloudhesive adquiere Eplexity, uno de los principales Premier Partners de Amazon Web Services";"https://www.iprofesional.com/tecnologia/386408-cloudhesive-adquiere-eplexity-premier-partner-de-aws";"iprofesional.com";"unknown journalist";"Argentina";"es";"155848";"2";"1"
